{
    "aggregatedVolumeDownwardCostlyAnora": 25.18,
    "aggregatedVolumeUpwardCostlyAnora": 86.71,
    "averageCostDownwardOraOrAnora": 40.58,
    "averageCostUpwardOraOrAnora": 43.07,
    "businessDay": "2024-12-27",
    "businessTimestamp": "2024-12-27T02:30:00Z",
    "comoDocumentType": "CS_MAPPING_TSO_DATA_INTERMEDIATE_RESULTS_PER_HOUR",
    "comoDocumentVersion": "R24Q4V1_0",
    "crosaVersion": 1,
    "csProcessType": "7a01827d0211c578e5933aeb",
    "csProcessVersion": 3,
    "hourCongested": true,
    "penaltyBalancingSlack": 13.49,
    "penaltyCostForAnoraVolumes": 79.27,
    "penaltyFlowSlack": 39.87,
    "psdfData": [
        {
            "convertedXnecId": "038ae5cf-487a-4900-973c-33b07943d1b2",
            "pstId": "20240402_DA_CROSA_ORA_8293",
            "sensitivity": 5958.125
        },
        {
            "convertedXnecId": "375bae2d-93fc-4bc5-ac74-1dedfd2155a1",
            "pstId": "20240405_DA_CROSA_ORA_3246",
            "sensitivity": 1783.061
        }
    ],
    "pstData": [
        {
            "costsPst": 155.43,
            "pstId": "20240402_DA_CROSA_ORA_8293",
            "tapAfter": 84.12,
            "tapBefore": 181.25
        },
        {
            "costsPst": 181.61,
            "pstId": "20240405_DA_CROSA_ORA_3246",
            "tapAfter": 61.05,
            "tapBefore": 158.55
        }
    ],
    "ptdfData": [
        {
            "convertedXnecId": "45e46118-23fd-4bed-ab12-58b624c3c353",
            "raId": "20240213_DA_CROSA_ORA_9582",
            "sensitivity": 0.614
        },
        {
            "convertedXnecId": "f2650f9a-0ebe-419b-b305-e1e16611335d",
            "raId": "20240825_DA_CROSA_ORA_1030",
            "sensitivity": 0.037
        }
    ],
    "raData": [
        {
            "costsOra": 161.12,
            "costsOraVariable": 199.95,
            "hourlyCostsAfterFixedCosts": 197.11,
            "hourlyCostsAfterReallocation": 193.6,
            "hourlyCostsFiltered": 41.23,
            "raId": "20240213_DA_CROSA_ORA_9582",
            "variableCostFinal": 152.28,
            "variableCostIntermediate": 161.77
        },
        {
            "costsOra": 194.28,
            "costsOraVariable": 179.75,
            "hourlyCostsAfterFixedCosts": 160.64,
            "hourlyCostsAfterReallocation": 190.4,
            "hourlyCostsFiltered": 80.78,
            "raId": "20240825_DA_CROSA_ORA_1030",
            "variableCostFinal": 197.55,
            "variableCostIntermediate": 158.98
        }
    ],
    "timeHorizon": "dayAhead",
    "totalCostsAllOras": 355.4,
    "totalCostsAllPsts": 337.04,
    "xnecData": [
        {
            "convertedXnecId": "038ae5cf-487a-4900-973c-33b07943d1b2",
            "fLimit": 49.95,
            "fPrimeB": 87.44,
            "fWithoutOrasAndPsts": 68.69
        },
        {
            "convertedXnecId": "375bae2d-93fc-4bc5-ac74-1dedfd2155a1",
            "fLimit": 35.51,
            "fPrimeB": 89.75,
            "fWithoutOrasAndPsts": 62.63
        },
        {
            "convertedXnecId": "45e46118-23fd-4bed-ab12-58b624c3c353",
            "fLimit": 49.93,
            "fPrimeB": 87.62,
            "fWithoutOrasAndPsts": 68.78
        },
        {
            "convertedXnecId": "f2650f9a-0ebe-419b-b305-e1e16611335d",
            "fLimit": 38.44,
            "fPrimeB": 89.79,
            "fWithoutOrasAndPsts": 64.12
        }
    ]
}