{
    "aggregatedVolumeDownwardCostlyAnora": 62.12,
    "aggregatedVolumeUpwardCostlyAnora": 82.61,
    "averageCostDownwardOraOrAnora": 15.57,
    "averageCostUpwardOraOrAnora": 91.74,
    "businessDay": "2024-03-26",
    "businessTimestamp": "2024-03-26T01:30:00Z",
    "comoDocumentType": "CS_MAPPING_TSO_DATA_INTERMEDIATE_RESULTS_PER_HOUR",
    "comoDocumentVersion": "R24Q4V1_0",
    "crosaVersion": 1,
    "csProcessType": "0f166630c2b13a4ac80fd6b5",
    "csProcessVersion": 1,
    "hourCongested": false,
    "penaltyBalancingSlack": 62.35,
    "penaltyCostForAnoraVolumes": 11.13,
    "penaltyFlowSlack": 66.07,
    "psdfData": [
        {
            "convertedXnecId": "477f97e4-1fbd-4d24-9175-2a758662fe2e",
            "pstId": "20241004_DA_CROSA_ORA_9427",
            "sensitivity": 5198.996
        },
        {
            "convertedXnecId": "4476e748-844f-4a87-b992-aebcbe27be76",
            "pstId": "20240408_DA_CROSA_ORA_5731",
            "sensitivity": 681.951
        },
        {
            "convertedXnecId": "90ccf897-7702-4bcc-8ee8-b1698211dd23",
            "pstId": "20240805_DA_CROSA_ORA_3345",
            "sensitivity": 2180.366
        },
        {
            "convertedXnecId": "0ad0539a-a9cc-4622-889d-dad4ce858910",
            "pstId": "20250113_DA_CROSA_ORA_7656",
            "sensitivity": 262.721
        },
        {
            "convertedXnecId": "0eec5938-660c-4606-b206-2dcf88d53991",
            "pstId": "20240503_DA_CROSA_ORA_1551",
            "sensitivity": 1908.98
        }
    ],
    "pstData": [
        {
            "costsPst": 198.5,
            "pstId": "20241004_DA_CROSA_ORA_9427",
            "tapAfter": 1.75,
            "tapBefore": 193.0
        },
        {
            "costsPst": 169.63,
            "pstId": "20240408_DA_CROSA_ORA_5731",
            "tapAfter": 33.5,
            "tapBefore": 154.86
        },
        {
            "costsPst": 186.98,
            "pstId": "20240805_DA_CROSA_ORA_3345",
            "tapAfter": 43.11,
            "tapBefore": 170.03
        },
        {
            "costsPst": 176.24,
            "pstId": "20250113_DA_CROSA_ORA_7656",
            "tapAfter": 9.53,
            "tapBefore": 158.44
        },
        {
            "costsPst": 177.32,
            "pstId": "20240503_DA_CROSA_ORA_1551",
            "tapAfter": 77.32,
            "tapBefore": 162.29
        }
    ],
    "ptdfData": [
        {
            "convertedXnecId": "45b7e57f-8c43-4aba-996e-122c5773e998",
            "raId": "20240131_DA_CROSA_ORA_2332",
            "sensitivity": 0.577
        },
        {
            "convertedXnecId": "e9edb69a-e2d2-4c42-b83d-b7ce0522a936",
            "raId": "20241116_DA_CROSA_ORA_6597",
            "sensitivity": 0.003
        }
    ],
    "raData": [
        {
            "costsOra": 152.9,
            "costsOraVariable": 187.1,
            "hourlyCostsAfterFixedCosts": 182.31,
            "hourlyCostsAfterReallocation": 150.63,
            "hourlyCostsFiltered": 43.9,
            "raId": "20240131_DA_CROSA_ORA_2332",
            "variableCostFinal": 178.61,
            "variableCostIntermediate": 161.84
        },
        {
            "costsOra": 197.08,
            "costsOraVariable": 180.15,
            "hourlyCostsAfterFixedCosts": 198.9,
            "hourlyCostsAfterReallocation": 199.67,
            "hourlyCostsFiltered": 79.5,
            "raId": "20241116_DA_CROSA_ORA_6597",
            "variableCostFinal": 189.41,
            "variableCostIntermediate": 178.75
        }
    ],
    "timeHorizon": "dayAhead",
    "totalCostsAllOras": 349.98,
    "totalCostsAllPsts": 908.67,
    "xnecData": [
        {
            "convertedXnecId": "477f97e4-1fbd-4d24-9175-2a758662fe2e",
            "fLimit": 40.56,
            "fPrimeB": 84.48,
            "fWithoutOrasAndPsts": 62.52
        },
        {
            "convertedXnecId": "4476e748-844f-4a87-b992-aebcbe27be76",
            "fLimit": 36.63,
            "fPrimeB": 96.36,
            "fWithoutOrasAndPsts": 66.5
        },
        {
            "convertedXnecId": "90ccf897-7702-4bcc-8ee8-b1698211dd23",
            "fLimit": 35.42,
            "fPrimeB": 83.74,
            "fWithoutOrasAndPsts": 59.58
        },
        {
            "convertedXnecId": "0ad0539a-a9cc-4622-889d-dad4ce858910",
            "fLimit": 40.17,
            "fPrimeB": 89.8,
            "fWithoutOrasAndPsts": 64.98
        },
        {
            "convertedXnecId": "0eec5938-660c-4606-b206-2dcf88d53991",
            "fLimit": 39.9,
            "fPrimeB": 95.16,
            "fWithoutOrasAndPsts": 67.53
        },
        {
            "convertedXnecId": "45b7e57f-8c43-4aba-996e-122c5773e998",
            "fLimit": 34.71,
            "fPrimeB": 95.15,
            "fWithoutOrasAndPsts": 64.93
        },
        {
            "convertedXnecId": "e9edb69a-e2d2-4c42-b83d-b7ce0522a936",
            "fLimit": 47.35,
            "fPrimeB": 94.32,
            "fWithoutOrasAndPsts": 70.83
        }
    ]
}