{
    "aggregatedVolumeDownwardCostlyAnora": 47.83,
    "aggregatedVolumeUpwardCostlyAnora": 28.32,
    "averageCostDownwardOraOrAnora": 66.33,
    "averageCostUpwardOraOrAnora": 34.9,
    "businessDay": "2024-06-14",
    "businessTimestamp": "2024-06-14T01:30:00Z",
    "comoDocumentType": "CS_MAPPING_TSO_DATA_INTERMEDIATE_RESULTS_PER_HOUR",
    "comoDocumentVersion": "R24Q4V1_0",
    "crosaVersion": 1,
    "csProcessType": "07e90e55b5d2d12c98fdcf92",
    "csProcessVersion": 4,
    "hourCongested": false,
    "penaltyBalancingSlack": 88.7,
    "penaltyCostForAnoraVolumes": 71.16,
    "penaltyFlowSlack": 10.7,
    "psdfData": [
        {
            "convertedXnecId": "d14a044a-1cea-4b83-8234-357187f9646e",
            "pstId": "20240406_DA_CROSA_ORA_3589",
            "sensitivity": 482.465
        },
        {
            "convertedXnecId": "2fe13949-52f7-4531-8db8-c5fc680e225d",
            "pstId": "20241130_DA_CROSA_ORA_7365",
            "sensitivity": 134.486
        },
        {
            "convertedXnecId": "6e7eaa49-4a25-406d-b256-8e9200cfcf46",
            "pstId": "20240127_DA_CROSA_ORA_8442",
            "sensitivity": 4685.675
        },
        {
            "convertedXnecId": "9df6bdde-4417-4ede-97ae-52aed64fe92b",
            "pstId": "20241123_DA_CROSA_ORA_3624",
            "sensitivity": 3312.565
        },
        {
            "convertedXnecId": "4a8827e5-7409-4af1-8e67-1d323263e8ef",
            "pstId": "20241009_DA_CROSA_ORA_1019",
            "sensitivity": 2012.205
        }
    ],
    "pstData": [
        {
            "costsPst": 190.59,
            "pstId": "20240406_DA_CROSA_ORA_3589",
            "tapAfter": 64.35,
            "tapBefore": 199.09
        },
        {
            "costsPst": 159.79,
            "pstId": "20241130_DA_CROSA_ORA_7365",
            "tapAfter": 95.19,
            "tapBefore": 162.99
        },
        {
            "costsPst": 188.9,
            "pstId": "20240127_DA_CROSA_ORA_8442",
            "tapAfter": 4.22,
            "tapBefore": 153.43
        },
        {
            "costsPst": 190.31,
            "pstId": "20241123_DA_CROSA_ORA_3624",
            "tapAfter": 47.87,
            "tapBefore": 176.26
        },
        {
            "costsPst": 198.28,
            "pstId": "20241009_DA_CROSA_ORA_1019",
            "tapAfter": 29.72,
            "tapBefore": 163.85
        }
    ],
    "ptdfData": [
        {
            "convertedXnecId": "189f936c-9973-4963-ba4c-713f45ebf422",
            "raId": "20240122_DA_CROSA_ORA_1744",
            "sensitivity": 0.642
        },
        {
            "convertedXnecId": "a807fa06-b81c-4f33-b8db-9a34a5865b41",
            "raId": "20240628_DA_CROSA_ORA_8895",
            "sensitivity": 0.14
        },
        {
            "convertedXnecId": "5b6382e9-83c8-452d-9160-2989f76f50e9",
            "raId": "20240507_DA_CROSA_ORA_8891",
            "sensitivity": 0.939
        },
        {
            "convertedXnecId": "c8d2ddee-cce7-4b6a-912e-ff9114fe7fda",
            "raId": "20240905_DA_CROSA_ORA_7789",
            "sensitivity": 0.602
        }
    ],
    "raData": [
        {
            "costsOra": 154.71,
            "costsOraVariable": 199.83,
            "hourlyCostsAfterFixedCosts": 166.42,
            "hourlyCostsAfterReallocation": 192.02,
            "hourlyCostsFiltered": 3.66,
            "raId": "20240122_DA_CROSA_ORA_1744",
            "variableCostFinal": 152.63,
            "variableCostIntermediate": 190.09
        },
        {
            "costsOra": 166.61,
            "costsOraVariable": 180.29,
            "hourlyCostsAfterFixedCosts": 153.04,
            "hourlyCostsAfterReallocation": 168.1,
            "hourlyCostsFiltered": 61.87,
            "raId": "20240628_DA_CROSA_ORA_8895",
            "variableCostFinal": 167.97,
            "variableCostIntermediate": 178.75
        },
        {
            "costsOra": 192.91,
            "costsOraVariable": 156.77,
            "hourlyCostsAfterFixedCosts": 160.99,
            "hourlyCostsAfterReallocation": 194.06,
            "hourlyCostsFiltered": 16.84,
            "raId": "20240507_DA_CROSA_ORA_8891",
            "variableCostFinal": 159.64,
            "variableCostIntermediate": 192.4
        },
        {
            "costsOra": 150.63,
            "costsOraVariable": 197.63,
            "hourlyCostsAfterFixedCosts": 167.9,
            "hourlyCostsAfterReallocation": 194.6,
            "hourlyCostsFiltered": 66.66,
            "raId": "20240905_DA_CROSA_ORA_7789",
            "variableCostFinal": 170.56,
            "variableCostIntermediate": 198.19
        }
    ],
    "timeHorizon": "dayAhead",
    "totalCostsAllOras": 664.86,
    "totalCostsAllPsts": 927.87,
    "xnecData": [
        {
            "convertedXnecId": "d14a044a-1cea-4b83-8234-357187f9646e",
            "fLimit": 42.79,
            "fPrimeB": 96.9,
            "fWithoutOrasAndPsts": 69.84
        },
        {
            "convertedXnecId": "2fe13949-52f7-4531-8db8-c5fc680e225d",
            "fLimit": 30.15,
            "fPrimeB": 85.17,
            "fWithoutOrasAndPsts": 57.66
        },
        {
            "convertedXnecId": "6e7eaa49-4a25-406d-b256-8e9200cfcf46",
            "fLimit": 31.1,
            "fPrimeB": 85.24,
            "fWithoutOrasAndPsts": 58.17
        },
        {
            "convertedXnecId": "9df6bdde-4417-4ede-97ae-52aed64fe92b",
            "fLimit": 39.09,
            "fPrimeB": 81.81,
            "fWithoutOrasAndPsts": 60.45
        },
        {
            "convertedXnecId": "4a8827e5-7409-4af1-8e67-1d323263e8ef",
            "fLimit": 44.1,
            "fPrimeB": 85.4,
            "fWithoutOrasAndPsts": 64.75
        },
        {
            "convertedXnecId": "189f936c-9973-4963-ba4c-713f45ebf422",
            "fLimit": 38.61,
            "fPrimeB": 84.98,
            "fWithoutOrasAndPsts": 61.8
        },
        {
            "convertedXnecId": "a807fa06-b81c-4f33-b8db-9a34a5865b41",
            "fLimit": 37.91,
            "fPrimeB": 95.42,
            "fWithoutOrasAndPsts": 66.66
        },
        {
            "convertedXnecId": "5b6382e9-83c8-452d-9160-2989f76f50e9",
            "fLimit": 33.24,
            "fPrimeB": 86.22,
            "fWithoutOrasAndPsts": 59.73
        },
        {
            "convertedXnecId": "c8d2ddee-cce7-4b6a-912e-ff9114fe7fda",
            "fLimit": 43.61,
            "fPrimeB": 96.49,
            "fWithoutOrasAndPsts": 70.05
        }
    ]
}