{
    "aggregatedVolumeDownwardCostlyAnora": 11.9,
    "aggregatedVolumeUpwardCostlyAnora": 18.84,
    "averageCostDownwardOraOrAnora": 13.27,
    "averageCostUpwardOraOrAnora": 69.27,
    "businessDay": "2024-12-08",
    "businessTimestamp": "2024-12-08T01:30:00Z",
    "comoDocumentType": "CS_MAPPING_TSO_DATA_INTERMEDIATE_RESULTS_PER_HOUR",
    "comoDocumentVersion": "R24Q4V1_0",
    "crosaVersion": 1,
    "csProcessType": "574a72b1c5599c538edbdee7",
    "csProcessVersion": 3,
    "hourCongested": true,
    "penaltyBalancingSlack": 56.72,
    "penaltyCostForAnoraVolumes": 12.73,
    "penaltyFlowSlack": 83.8,
    "psdfData": {
        "convertedXnecId": "b9fe2db9-afe9-4f69-b530-f71710d6cf6f",
        "raId": "19716f72-aefa-4d9f-b00f-576635b9bc51",
        "sensitivity": 30356.267440794454
    },
    "pstData": [
        {
            "costsPst": 96.41,
            "pstId": "4a3092b4698f3609287b46cb",
            "tapAfter": 99.98,
            "tapBefore": 21.3
        }
    ],
    "ptdfData": {
        "convertedXnecId": "e10f890c-d35d-4f2c-9838-fd82181d44c0",
        "raId": "c7e4d695-e6ee-442d-b5fa-0f44f76a016b",
        "sensitivity": 1.8
    },
    "raData": [
        {
            "costsOra": 193.81,
            "costsOraVariable": 197.06,
            "hourlyCostsAfterFixedCosts": 182.56,
            "hourlyCostsAfterReallocation": 199.77,
            "hourlyCostsFiltered": 22.08,
            "raId": "6b648b16-1c70-46f4-b90b-ee862a14d5dd",
            "variableCostFinal": 169.25,
            "variableCostIntermediate": 192.45
        },
        {
            "costsOra": 165.21,
            "costsOraVariable": 167.21,
            "hourlyCostsAfterFixedCosts": 179.55,
            "hourlyCostsAfterReallocation": 198.13,
            "hourlyCostsFiltered": 12.38,
            "raId": "50cc8cd1-0046-4c25-9013-76eae000134f",
            "variableCostFinal": 175.18,
            "variableCostIntermediate": 179.53
        }
    ],
    "timeHorizon": "dayAhead",
    "totalCostsAllOras": 359.02,
    "totalCostsAllPsts": 6.09,
    "xnecData": [
        {
            "convertedXnecId": "652ecb5b91874a411d6ac3c2",
            "fLimit": 58.99,
            "fPrimeB": 23.63,
            "fWithoutOrasAndPsts": 18.68
        }
    ]
}